{
  "protocol_version": "1.0",
  "request_id": "context-read-synthetic-001",
  "operation": "read",
  "actor": {
    "type": "ephy",
    "id": "ephy"
  },
  "scope": {
    "projects": ["ephy"],
    "tags": [],
    "sensitivity_ceiling": "internal"
  },
  "query": null,
  "doc_id": "doc:synthetic-context-001",
  "created_at": "2026-09-01T00:00:00Z"
}
